15:00:05.015667 eth0  M   IP 172.19.176.1.5353 > 224.0.0.251.5353: 0 ANY (QM)? DESKTOP-BTS6FR2.local. (39)
15:00:05.015668 eth0  M   IP 172.19.176.1.5353 > 224.0.0.251.5353: 0*- [0q] 2/0/0 AAAA fe80::b80c:95c4:fe6c:a84f, A 172.19.176.1 (77)
15:00:05.020010 eth0  M   IP6 fe80::b80c:95c4:fe6c:a84f.5353 > ff02::fb.5353: 0 ANY (QM)? DESKTOP-BTS6FR2.local. (39)
15:00:05.020011 eth0  M   IP6 fe80::b80c:95c4:fe6c:a84f.5353 > ff02::fb.5353: 0*- [0q] 2/0/0 AAAA fe80::b80c:95c4:fe6c:a84f, A 172.19.176.1 (77)
15:00:05.878924 eth0  Out IP 172.19.186.122.57259 > 185.125.190.56.123: NTPv4, Client, length 48
15:00:05.964223 eth0  In  IP 185.125.190.56.123 > 172.19.186.122.57259: NTPv4, Server, length 48
15:00:06.486820 eth0  M   IP 172.19.176.1.5353 > 224.0.0.251.5353: 0 A (QM)? wpad.local. (28)
15:00:06.487999 eth0  M   IP6 fe80::b80c:95c4:fe6c:a84f.5353 > ff02::fb.5353: 0 A (QM)? wpad.local. (28)
15:00:06.913430 eth0  B   IP 172.19.176.1.137 > 172.19.191.255.137: UDP, length 50
15:00:07.529669 eth0  M   IP 172.19.176.1.5353 > 224.0.0.251.5353: 0 A (QM)? wpad.local. (28)
15:00:07.530415 eth0  M   IP6 fe80::b80c:95c4:fe6c:a84f.5353 > ff02::fb.5353: 0 A (QM)? wpad.local. (28)
15:00:07.690881 eth0  B   IP 172.19.176.1.137 > 172.19.191.255.137: UDP, length 50
15:00:08.460676 eth0  B   IP 172.19.176.1.137 > 172.19.191.255.137: UDP, length 50
15:00:09.534377 eth0  M   IP 172.19.176.1.5353 > 224.0.0.251.5353: 0 A (QM)? wpad.local. (28)
15:00:09.536198 eth0  M   IP6 fe80::b80c:95c4:fe6c:a84f.5353 > ff02::fb.5353: 0 A (QM)? wpad.local. (28)
15:00:09.956597 eth0  B   IP 172.19.176.1.137 > 172.19.191.255.137: UDP, length 50
15:00:09.970206 eth0  In  ARP, Request who-has 172.19.186.122 (00:15:5d:38:68:81) tell 172.19.176.1, length 28
15:00:09.970232 eth0  Out ARP, Reply 172.19.186.122 is-at 00:15:5d:38:68:81, length 28
15:00:10.295523 eth0  Out ARP, Request who-has 172.19.176.1 tell 172.19.186.122, length 28
15:00:10.296063 eth0  In  ARP, Reply 172.19.176.1 is-at 00:15:5d:49:f4:f0, length 28
